Phase Number,Phase Name,Purpose,Status for Functional App
Phase 1,Database Schema Design & Validation,"Design normalized schema, constraints, indexes, triggers",COMPLETED
Phase 2,API Contract Design & Implementation,"Build all REST APIs module-by-module",COMPLETED
Phase 3,Order & Payment Workflow Integration,"Connect Cart → Address → Order → Payment → Invoice",COMPLETED
Phase 4,Security, Validation & Hardening,"Rate limiting, deep validation, edge-case security",PARTIALLY SKIPPED
Phase 5,Testing & Quality Assurance,"Unit tests, integration tests, automation",MOSTLY SKIPPED
Phase 6,Performance & Scalability,"Caching, query tuning, Redis, load handling",FULLY SKIPPED
Phase 7,Deployment Readiness,"CI/CD, production configs, monitoring",FULLY SKIPPED
